{
  "run_id": "cr-20260225-001",
  "work_packet_id": "wp-20260225-contact-form",
  "container_profile": "node",
  "container_target": "src/app/services/contacts",
  "image_digest": "sha256:a1b2c3d4e5f6a1b2c3d4e5f6a1b2c3d4e5f6a1b2c3d4e5f6a1b2c3d4e5f6a1b2",
  "build_log": "changesets/outbox/wp-20260225-contact-form/container/build.log",
  "test_results": [
    {
      "suite": "unit",
      "passed": 42,
      "failed": 0,
      "skipped": 2
    },
    {
      "suite": "integration",
      "passed": 8,
      "failed": 0,
      "skipped": 0
    }
  ],
  "exit_code": 0,
  "doctrine_version": "3.5.0",
  "timestamp": "2026-02-25T15:30:00Z"
}
